{
  "contract_version": "horoscope_period_response",
  "service_code": "horoscope_free_next_7_days_natal",
  "period_resolution": {
    "period_profile_code": "next_7_days",
    "anchor_date": "2026-06-07",
    "timezone": "Europe/Paris",
    "start_datetime_local": "2026-06-07T00:00:00",
    "end_datetime_local": "2026-06-14T00:00:00",
    "start_datetime_utc": "2026-06-06T22:00:00+00:00",
    "end_datetime_utc": "2026-06-13T22:00:00+00:00",
    "end_exclusive": true,
    "duration_days": 7,
    "included_dates": ["2026-06-07", "2026-06-08", "2026-06-09", "2026-06-10", "2026-06-11", "2026-06-12", "2026-06-13"],
    "included_days": []
  },
  "summary": {
    "title": "Vos 7 prochains jours",
    "text": "Les prochains jours donnent surtout une tendance à comprendre plutôt qu'un planning à suivre. Autour du 2026-06-07, le climat met l'accent sur organisation : une priorité simple, un échange à clarifier ou une routine à stabiliser peut devenir le fil conducteur. L'intérêt est de repérer ce qui demande de l'attention sans découper chaque journée ni chercher une fenêtre idéale. Gardez une marge pour ajuster votre rythme, observez les moments où les émotions accélèrent les décisions, puis revenez à une action concrète. Cette lecture reste volontairement compacte : elle sert de boussole générale pour choisir ce qui mérite d'être traité maintenant et ce qui peut attendre."
  },
  "dominant_theme": {
    "theme": "organisation",
    "text": "Le thème dominant est organisation. Il invite à privilégier une décision simple, reliée à vos repères personnels, plutôt qu'une dispersion sur plusieurs sujets."
  },
  "key_days": [
    {
      "date": "2026-06-07",
      "title": "Jour à retenir",
      "reason": "Le thème organisation ressort plus nettement et donne un repère utile sans en faire un verdict.",
      "evidence_keys": ["period:2026-06-07:2026-06-07:noon:moon:natal_house:6"],
      "fallback_reason": null
    }
  ],
  "advice": "Choisissez une seule priorité observable et gardez assez de souplesse pour l'ajuster. Notez ce qui se répète avant de conclure.",
  "watch_summary": {
    "status": "low",
    "text": "Une vigilance légère suffit : ralentir si une réaction paraît plus forte que la situation.",
    "evidence_keys": ["period:2026-06-07:2026-06-07:noon:moon:natal_house:6"]
  },
  "evidence_summary": [
    {
      "evidence_key": "period:2026-06-07:2026-06-07:noon:moon:natal_house:6",
      "date": "2026-06-07",
      "label": "La Lune met en avant un repère d'organisation concret."
    }
  ],
  "quality": {
    "daily_timeline_count": 0,
    "evidence_guard_passed": true,
    "best_watch_overlap_passed": true,
    "provider": "fake",
    "model": "fake-model",
    "fallback_used": false,
    "period_contract": "free_next_7_days"
  }
}
